{
  "schema_version": "secret-0002-0.1",
  "session_id": "session.req.analytics.20260413.002",
  "decision": "deny",
  "session_state": "denied",
  "bridge_trace": "trace.analytics.20260413.002",
  "bridge_decision_effect": "burn",
  "request_id": "req.analytics.20260413.002",
  "binding_id": "binding.reporting-db",
  "secret_id": "secret.analytics.reporting-db",
  "secret_class": "database-credential",
  "backend_profile_id": "backend.vault-dynamic-db",
  "materializer_profile_id": "materializer.systemd-credential",
  "consumer": {
    "kind": "systemd-unit",
    "id": "analytics-reporter.service"
  },
  "mode": "burn",
  "session_epoch": 8,
  "secret_epoch": 12,
  "issued_at": "2026-04-13T14:30:00Z",
  "expires_at": "2026-04-13T14:30:00Z",
  "backend_operation": {
    "kind": "none",
    "ref": "deny"
  },
  "handle": {
    "kind": "deny",
    "ref": "deny"
  },
  "steps": [
    "deny"
  ],
  "revalidation_triggers": [
    "bridge-burn",
    "secret-epoch-change",
    "attestation-loss",
    "consumer-exit"
  ],
  "constraints": {
    "non_exportable": false,
    "model_reentry_prohibited": true,
    "log_redaction_required": true,
    "destroy_on_exit": true
  },
  "teardown_actions": [],
  "deny_reasons": [
    "bridge burn: AUDIT_TAMPER_DETECTED",
    "bridge mode burn denies new materialization sessions",
    "request mode not permitted by binding"
  ]
}
