{
  "schema_version": "secret-0002-0.1",
  "session_id": "session.req.signing.20260413.001",
  "decision": "allow",
  "session_state": "issued",
  "bridge_trace": "trace.signing.20260413.001",
  "bridge_decision_effect": "accept",
  "request_id": "req.signing.20260413.001",
  "binding_id": "binding.release-signing-key",
  "secret_id": "secret.signing.release-artifact",
  "secret_class": "signing-key",
  "backend_profile_id": "backend.hsm-rooted-signing",
  "materializer_profile_id": "materializer.unix-socket-proxy",
  "consumer": {
    "kind": "service",
    "id": "release-signer"
  },
  "mode": "safe",
  "session_epoch": 11,
  "secret_epoch": 42,
  "issued_at": "2026-04-13T14:30:00Z",
  "expires_at": "2026-04-13T14:40:00Z",
  "backend_operation": {
    "kind": "sign-proxy",
    "ref": "hsmop://secret.signing.release-artifact/req.signing.20260413.001"
  },
  "handle": {
    "kind": "socket-ref",
    "ref": "unix:///run/bridge/secret.signing.release-artifact/req.signing.20260413.001.sock"
  },
  "steps": [
    "resolve-binding",
    "verify-profiles",
    "verify-attestation",
    "authorize-hsm-operation",
    "open-unix-socket-proxy",
    "bind-socket-to-consumer",
    "emit-audit"
  ],
  "revalidation_triggers": [
    "bridge-burn",
    "secret-epoch-change",
    "attestation-loss",
    "consumer-exit"
  ],
  "constraints": {
    "non_exportable": true,
    "model_reentry_prohibited": true,
    "log_redaction_required": true,
    "destroy_on_exit": true
  },
  "teardown_actions": [
    "destroy-on-exit",
    "zeroize-local-plaintext",
    "revoke-on-burn",
    "unlink-files-on-exit"
  ]
}
