{
  "schema_version": "secret-0002-0.1",
  "session_id": "session.req.analytics.20260413.001",
  "decision": "allow",
  "session_state": "issued",
  "bridge_trace": "trace.analytics.20260413.001",
  "bridge_decision_effect": "accept",
  "request_id": "req.analytics.20260413.001",
  "binding_id": "binding.reporting-db",
  "secret_id": "secret.analytics.reporting-db",
  "secret_class": "database-credential",
  "backend_profile_id": "backend.vault-dynamic-db",
  "materializer_profile_id": "materializer.systemd-credential",
  "consumer": {
    "kind": "systemd-unit",
    "id": "analytics-reporter.service"
  },
  "mode": "normal",
  "session_epoch": 7,
  "secret_epoch": 12,
  "issued_at": "2026-04-13T14:30:00Z",
  "expires_at": "2026-04-13T14:32:00Z",
  "backend_operation": {
    "kind": "issue-dynamic",
    "ref": "lease://secret.analytics.reporting-db/req.analytics.20260413.001"
  },
  "handle": {
    "kind": "credential-file",
    "ref": "/run/credentials/analytics-reporter.service/secret.analytics.reporting-db/req.analytics.20260413.001"
  },
  "steps": [
    "resolve-binding",
    "verify-profiles",
    "verify-attestation",
    "issue-dynamic-lease",
    "write-credential-directory",
    "chmod-consumer-only",
    "emit-audit"
  ],
  "revalidation_triggers": [
    "bridge-burn",
    "secret-epoch-change",
    "attestation-loss",
    "consumer-exit"
  ],
  "constraints": {
    "non_exportable": false,
    "model_reentry_prohibited": true,
    "log_redaction_required": true,
    "destroy_on_exit": true
  },
  "teardown_actions": [
    "destroy-on-exit",
    "zeroize-local-plaintext",
    "revoke-on-burn",
    "unlink-files-on-exit"
  ]
}
